subreddit,term,description
afl,Ball ,(shouted) holding the ball
afl,Ball-up,"(also: bounce, ruck) a restart of play after the ball has been whistled dead"
afl,Banana,(also: checkside punt) kick bending around the body
afl,Behind,"point, 1 point, ball goes through the outer posts but is not a goal"
afl,Clanger,terrible kick
afl,Disposal ,"(also: possession, touch) handpass or kick"
afl,Fifty-metre penalty ,"kick awarded after an egregious infraction, where the ball is moved 50 metres closer to the goal"
afl,Free kick ,kick awarded after a mark or an infraction
afl,Goal ,6 points = kick through the centre posts
afl,Handpass ,fisting the ball to another player
afl,Hit-out ,cleanly winning a ruck contest
afl,Interchange,(also: bench) the substitution of players during the run of play; must run in and out of the field of play through a marked gate
afl,Knock-on ,hitting the ball to a teammate without ever having possession of it
afl,Mark ,cleanly catching the ball from a kick over 15 metres away; results in a free kick
afl,One-percenter,"knock-on, spoil, smother, shepherd"
afl,Percentage,points scored divided by points against; is the first tiebreaker (after win-loss-tie) on the ladder
afl,Play-on ,(also: advantage) playing through the whistle for a mark or a free kick
afl,Rushed behind ,1 point for the other team = running the ball through your own outer posts
afl,Shepherd ,blocking opponents from getting the ball
afl,Smother ,blocking a kick
afl,Screamer ,(also: specky) spectacular mark
afl,Spoil ,punching the ball away to keep the other team from gaining possession
afl,Tagger ,"defensive player, usually defending against the other side's best all game"
afl,Torpedo ,spiral punt; longest sort of punt in ARF
afl,50-metre arc ,the arc 50 metres from each goal
afl,Centre circle,the circle where rucks occur at the start of each quarter and after a goal has been scored
afl,Centre square ,a 50m x 50m square in the centre of the ground
afl,Goal square,the square in front of each goal
afl,Back,"or back(line). left back pocket, back flank, right back pocket"
afl,Half-back,"half-back, centre half-bank, half-back"
afl,Centre,"wing, centre, wing"
afl,Half-forward,"half-forward flank, centre half-forward, half-forward flank"
afl,Forward,"(line): left forward pocket, full-forward, right forward pocket"
afl,Followers,"ruck, ruck rover, rover"
afl,Brownlow Medal ,"competition best and fairest award as determined by umpire votes, the most prestigious award in the game, similar to MVP awards (the Leigh Matthews Trophy, presented by the AFLPA, is analogous to an MVP award)"
afl,Coleman Medal ,medal presented to the leading goalkicker
afl,Minor Premiership ,top of the ladder at the end of the home & away season; there is no cup for this
afl,Norm Smith Medal ,medal presented to the best on ground at the Grand Final
afl,Premiership Cup ,award presented to the premiers
afl,Rising Star Award,best and fairest player under 21 who had played less than 10 AFL games prior to the season; similar to Rookie of the Year awards
afl,Barrack ,"cheer or root for. (Rooting someone, incidentally, means, screwing them in Australia.)"
afl,Boundary ,sideline
afl,Finals ,play-offs
afl,Fixture,"(sing.) draw, schedule"
afl,Fixtures,(pl.) games
afl,Ground ,field
afl,Guernsey ,jersey
afl,Home & away ,regular season
afl,Ladder ,"table, standings"
afl,List ,roster
afl,Premiers ,champions
afl,Recruit ,(verb) acquire
afl,Rounds ,weeks
afl,Sledge,"trash talk, chirp"
afl,Tipping,pick’em
afl,bogan ,is a redneck is a hoser is a chav
airforce,AAFES,Army & AF Exchange Service (Like a Wal-Mart on base)
airforce,ABU,Airman Battle Uniform (Our camo utility uniform)
airforce,AD,Active Duty
airforce,AFB,Air Force Base
airforce,AFOQT,Air Force Officer Qualification Test (Academic Entrance Test for commissioning as an officer)
airforce,AFOSI,Air Force Office of Special Investigations (Basically the FBI of the Air Force)
airforce,AFSC,Air Force Specialty Code (A particular job. Each one has a special code)
airforce,ALCON,All Concerned (When addressing a group of people that need to know about a particular topic)
airforce,ASAP,As Soon As Possible
airforce,ASVAB,Armed Services Vocational Aptitude Battery (Academic entrance test for enlisting)
airforce,ATC,Air Traffic Control
airforce,AWOL,Away Without Official Leave (You ran away from the military)
airforce,BAH,Basic Allowance for Housing (A monthly tax-free allowance added to your base pay for you to pay for a place to live)
airforce,BAS,Basic Allowance for Subsistence (A tax-free food allowance paid every month)
airforce,BCD,Bad Conduct Discharge (Also Big Chicken Dinner)
airforce,BLUF,Bottom Line Up Front (TL;DR for the Air Force)
airforce,BMT,Basic Military Training (Boot camp)
airforce,BTZ,Below-the-zone (6-month early promotion to senior airman)
airforce,BX,"Base Exchange (Run by AAFES, like a Wal-Mart on most bases)"
airforce,CAC,"Common Access Card (Your ID, and used to login to government computers)"
airforce,CONUS,Continental United States
airforce,COT,"Commissioned Officer Training (An abbreviated version of OTS, for direct-commissioned officers like lawyers and doctors)"
airforce,CQ,Charge of Quarters (Usually a desk at the dorms or other areas that is manned 24 hours for safety and tracking personnel)
airforce,DEERS,Defense Enrollment Eligibility Reporting System (A system to track dependents in order to give them military benefits)
airforce,DEP,Delayed Entrance Program (Waiting to go to BMT)
airforce,DFAC,Dining Facility
airforce,DITY,Do-it-yourself move (Move your own stuff when doing a PCS)
airforce,DLI,Defense Language Institute (Language learning school for the DoD)
airforce,DOD,Department of Defense (Government department that contains all branches of the military)
airforce,EFMP,Exceptional Family Member Program (A program to make sure dependents with special medical needs receive the care they need when PCSing to a new base)
airforce,EPR,Enlisted Performance Report (Yearly job performance review)
airforce,FUBAR,Fucked up beyond all repair
airforce,FYI,For Your Information
airforce,FYSA,For Your Situational Awareness
airforce,IAW,In Accordance With
airforce,IG,"Inspector General (Oversight for fraud waste and abuse, abuse of power, and other things on a base)"
airforce,IYAAYAS,"If you ain't ammo, you ain't shit (A common saying by those in the Ammo career field)"
airforce,JAG,Judge Advocate General (Military Lawyers)
airforce,LES,Leave and Earning Statement (Basically your pay stub describing your pay)
airforce,MEPS,Military Entrance Processing Station (A regional building where you'll go to complete your physical and paperwork to enlist)
airforce,MPF,Military Personnel Flight/Section (Personnelists that supposedly are there to help you with your military document issues)
airforce,MPS,Military Personnel Flight/Section (Personnelists that supposedly are there to help you with your military document issues)
airforce,MRE,Meal Ready to Eat (High calorie non-perishable food packs to eat when other food isn't available)
airforce,MTI,Military Training Instructor (More commonly known as a drill sergeant)
airforce,MTL,"Military Training Leader (Like a nicer MTI, but at tech school)"
airforce,MWR,"Morale, Welfare, Recreation"
airforce,NCO,Non-commissioned Officer (Staff Sergeant [E-5] and above in the AF)
airforce,NCOIC,NCO in Charge
airforce,OCONUS,Outside Continental United States
airforce,OCP,Operational Camouflage Pattern
airforce,OPR,Officer Performance Report (Yearly job performance review)
airforce,OTS,Officer Training School
airforce,PCS,Permanent Change of Station (Moving to a new base/assignment)
airforce,PFA,Personal Fitness Assessment
airforce,PFT,Personal Fitness Test
airforce,PTU,Physical Training Uniform
airforce,POA,"Power of Attorney (Let other people sign legal documents for you, if you're deployed or unavailable)"
airforce,POC,Point of Contact
airforce,POTUS,President of the United States
airforce,PT,Physical Training
airforce,ROTC,Reserve Officer Training Corps (A path to commission as an officer while going to college)
airforce,RPA,Remotely Piloted Aircraft (Drone)
airforce,SA,Situational Awareness
airforce,SCIF,Sensitive Compartmented Information Facility (A secure place to store and handle classified information)
airforce,SERE,"Survival, Evasion, Resistance, Escape"
airforce,SF,Security Forces (Cops)
airforce,SOP,Standard Operating Procedure
airforce,TACP,Tactical Air Control Party
airforce,TBD,To Be Determined
airforce,TDY,Temporary Duty (Travel for work)
airforce,TIG,Time in Grade (The time you've been in your current pay grade)
airforce,TIS,Time in Service (The time you've been in the military)
airforce,TS,Top Secret
airforce,UAS,Unmanned Aerial System (Drone)
airforce,UAV,Unmanned Aerial Vehicle (Drone)
airforce,USAF,United States Air Force
airforce,USAFA,"US Air Force Academy (The Air Force's service academy, a four year college in Colorado Springs, CO)"
airforce,USO,"United Service Organizations (Organization to support the military with entertainment, a place with free food and snacks in most airports, etc)"
airforce,V/R,Very Respectfully (Usually used at the end of emails)
amitheasshole,YTA,You're the Asshole 
amitheasshole,NTA,Not the A-hole 
amitheasshole,ESH,Everyone Sucks here 
amitheasshole,NAH,No A-holes here
amitheasshole,INFO,Not Enough Info
antimlm,MLM,Multi Level Marketing
antimlm,Hun,"People who shill products/services for an MLM. The sellers have a tendency to frequently use the word ""hun"" when initiating a sales pitch. Ex: “Hey hun ❤️❤️ I see your aunt is dying 😱😱 anyway hun 😊💁‍♀️ wanna buy my oils it’s good for stress 😍😘😘”"
antimlm,LLR,LulaRoe
antimlm,SAHM,Stay At Home Mom
aquariums,40b,a 40 gallon breeder; a type of aquarium
aquariums,ABF,African Butterfly Fish
aquariums,ADF,African Dwarf Frog
aquariums,AFAIK,As Far As I Know
aquariums,AKA,Also known as
aquariums,API,Company that makes a good test kit
aquariums,Aro,"Arowana, a type of fish"
aquariums,ATO,Automatic Top Off
aquariums,BBA,Black Beard Algae
aquariums,BN,Bristle Nose Pleco
aquariums,BNP,Bristle Nose Pleco
aquariums,Betta,More commonly known as a Siamese Fighting Fish
aquariums,CAE,Chinese Algae Eater
aquariums,Canister,type of filter
aquariums,CB,Captive Bred
aquariums,CFL,Compact Fluorescent Light
aquariums,CL,Craigslist
aquariums,CO2,Carbon Dioxide; Used to grow plants. Injected into the aquarium via a diffuser.
aquariums,C02,Carbon Dioxide; Used to grow plants. Injected into the aquarium via a diffuser.
aquariums,CPO,Orange Dwarf Crayfish/Mexican Dwarf Crayfish
aquariums,Cycle,Reminder to read the sidebar!
aquariums,DG,Dwarf Gourami
aquariums,DGIV,"Dwarf Gourami Iridovirus, a poorly understood and often fatal iridovirus that afflicts species of the genus Trichogaster"
aquariums,DIY,Do It Yourself
aquariums,DT,Display Tank
aquariums,EBJD,Electric Blue Jack Dempsey
aquariums,EI,Estimative Index; a method of dosing fertalizers
aquariums,EOTD,"End of tank dump; when a CO2 tank runs low on pressure, the regulator can't handle it and leaks the CO2 out into the tank."
aquariums,F1,"First aquarium bred generation, Second, etc..."
aquariums,F2,"First aquarium bred generation, Second, etc..."
aquariums,FOWLR,Fish only with live rock (saltwater)
aquariums,FTS,Full Tank Shot
aquariums,FW,Freshwater
aquariums,Ferts,Fertalizers
aquariums,Fry,Baby fish
aquariums,Gal,Gallon
aquariums,g,Gallon
aquariums,GBR,German Blue Ram
aquariums,GH,"General Hardness; a measure of calcium, magensium, and other ions"
aquariums,GSP,Green Spotted Puffer
aquariums,HOB,Hang on Back filter (ex. Aquaclear 10)
aquariums,HT,Hospital Tank
aquariums,ICH,Type of fish disease
aquariums,IMO,In My Opinion
aquariums,Invert,Invertebrate
aquariums,KH,Carbonate Hardness; a measure of the alkalinity of water
aquariums,Kribs,Kribensis; type of dwarf cichlid
aquariums,L,Litre
aquariums,LED,Light-emitting diode
aquariums,LFS,Local Fish Store
aquariums,LPS,Local Pet Store
aquariums,MFK,Monster Fish Keepers
aquariums,MSS,Mineralized Soil Substrate
aquariums,MTS,"Multiple Tank Syndrome, Malaysian Trumpet Snail, or Mineralized Topsoil Substrate"
aquariums,Macro,"Nutrients that plants need in large doses, or macroalgae such as chaeto"
aquariums,Micro,Nutrients that plants need in small doses
aquariums,NH3,Ammonia
aquariums,NO2,Nitrite
aquariums,NO3,Nitrate
aquariums,NLS,New Life Spectrum
aquariums,NTD,Neon Tetra Disease
aquariums,NTS,New Tank Syndrome; see cycling
aquariums,Oscar,Large species of South American Cichlid. Care Sheet
aquariums,Oto,Otocinclus; a small catfish
aquariums,Params,"Parameters of your water. Typically ammonia, nitrites, nitrates"
aquariums,Pleco,Plecostomus; common name of a freshwater catfish
aquariums,PO4,Phosphate
aquariums,PPM,Parts Per Million
aquariums,Python,A syphon that attaches to your tap
aquariums,Q,Quarantine
aquariums,QT,Quarantine
aquariums,Ram,Species of South American Cichlid
aquariums,RCS,Red Cherry Shrimp
aquariums,RES,Red-Eared Slider; type of turtle.
aquariums,RO/DI,Reverse Osmosis Deionized ; used for water purification
aquariums,DI,Reverse Osmosis Deionized ; used for water purification
aquariums,RTGG,Red Tail Giant Gourami
aquariums,SA,South American Cichlid
aquariums,SAC,South American Cichlid
aquariums,SAE,Siamese Algae Eater
aquariums,Sp,Species
aquariums,SW,Saltwater
aquariums,TBH,To Be Honest
aquariums,TDS,Total Dissolved Solids - you can get meters on Amazon for like $15
aquariums,TIL,Today I learned
aquariums,WC,Water Change or Wild Caught
aquariums,pH,potential of hydrogen; the acidity or basicity of your water
askgaybros,Bear,"Larger versions of Otters and older versions of cubs (25+), ranging from above average to hugely overweight in build. Considerable body hair, usually untrimmed sometimes with facial hair."
askgaybros,Bull,Muscular men similar to muscle bears but typically with a larger build and average body/facial hair.
askgaybros,Chaser,"Chasers can be almost any body type, build, or age and are linked to chubs. This group are attracted romantically and physically to chubs and typically referred to as chub chasers."
askgaybros,Chub,Overweight or obese man similar to bears but with little-no body hair. Chubs are often considered to be larger build than most bears but it's unclear whether this is universally accurate.
askgaybros,Cub,"Younger version of a Bear (<25). Often smaller build than a bear but still above average at least, body hair present on most of the body & facial hair dependent on age."
askgaybros,Goat,A sometimes derogatory term for older gay men that do not fit other definitions - usually otter type builds with white/gray body hair or no hair at all.
askgaybros,Jock,"Muscular and athletic young men, usually with little-no body hair - often linked to the sporting world."
askgaybros,Muscle Bear,A bear with a muscular build rather than typical bear fat.
askgaybros,Otter,Typically a thin-average build man with noticeable body hair. Trimmed/Untrimmed & facial hair optional.
askgaybros,Polar Bear,"A bear, but with white/gray hair instead - usually older."
askgaybros,Pup,"A term used to describe young men in the gay community. Usually <25 with average build, little-no body or facial hair. Can also be used specifically to refer to anyone inexperienced."
askgaybros,Twink,"Young (<25) or young-looking men with little-no body hair, usually no facial hair, and a slender/thin build."
askgaybros,Twunk,"A twink, but more muscular. Somewhere between a twink, jock, and hunk."
askgaybros,Wolf,Muscular/Lean well-built men somewhere on the scale of otter-bear in terms of body hair. Usually extensive facial hair.
askgaybros,Ally,A straight individual who advocates for the rights and acceptance of GSD individuals.
askgaybros,Bottom,"Gay man who is or prefers to be the penetrated (""passive"") partner in anal sex. Known colloquially as ""catcher."""
askgaybros,Cis,An individual whose sex assigned at birth matches their gender.
askgaybros,cisgender,An individual whose sex assigned at birth matches their gender.
askgaybros,Dom,The dominant partner in a relationship. Can be used in both romantic and sexual contexts.
askgaybros,Fem,"Term used to describe or self-identify as a gay man with more traditionally feminine interests, mannerisms, or appearance. Often considered to be the 'gay stereotype'."
askgaybros,GSD,"A new, up-and-coming acronym created to be more inclusive and concise than LGBTQIA. Stands for gender and sexual diversities."
askgaybros,Intersex,An individual who does not biologically conform to one of the binary sexes from birth.
askgaybros,LGBT,"The most common acronym used to describe the community of individuals on the queer spectrum. Stands for Lesbian, Gay, Bisexual, Transgender, Questioning, Intersex, and the A, depending on who you ask, is either asexual or ally."
askgaybros,LGBTQ,"The most common acronym used to describe the community of individuals on the queer spectrum. Stands for Lesbian, Gay, Bisexual, Transgender, Questioning, Intersex, and the A, depending on who you ask, is either asexual or ally."
askgaybros,LGBTQIA,"The most common acronym used to describe the community of individuals on the queer spectrum. Stands for Lesbian, Gay, Bisexual, Transgender, Questioning, Intersex, and the A, depending on who you ask, is either asexual or ally."
askgaybros,Masc,"Term used to describe or self-identify as a gay man with more traditionally masculine interests, mannerisms, or appearance. Sometimes referred to as ""butch"" or, more controversially, ""straight-acting."""
askgaybros,Poz,An HIV-positive individual.
askgaybros,Str8,"Can refer to a straight male or can refer to a man who is not straight but appears to be (see ""straight-acting""). Often used derogatorily or sarcastically."
askgaybros,Sub,The submissive partner in a relationship. Can be used in both romantic and sexual contexts.
askgaybros,Top,"Gay man who is or prefers to be the penetrating (""active"") partner in anal sex. Known colloquially as ""pitcher."""
askgaybros,Trans,"An individual whose sex assigned at birth does not match their gender. Includes FTM (female-to-male), MTF (male-to-female), and gender-nonconforming."
askgaybros,transgender,"An individual whose sex assigned at birth does not match their gender. Includes FTM (female-to-male), MTF (male-to-female), and gender-nonconforming."
askgaybros,Vers,Gay man who plays both top and bottom roles during anal sex or has no strong preference between the two.
askgaybros,versatile,Gay man who plays both top and bottom roles during anal sex or has no strong preference between the two.
askgaybros,Bareback,Anal sex without a condom.
askgaybros,BB,Anal sex without a condom.
askgaybros,BDSM,"Stands for Bondage Discipline Sadism Masochism. Sexual pleasure through the infliction of pain by a dom onto a sub. Practices include handcuffs, ties/rope, whips, and full-body bondage equipment. Also known as ""S&M"" or sadomasochism."
askgaybros,CBT,"Stands for Cock and Ball Torture. A more specifically male branch of BDSM centered on genitalia. Involves squeezing, slapping, pulling, weights, etc."
askgaybros,Choking,A relative of BDSM involving the voluntary constriction of breathing during sex.
askgaybros,Asphyxiation,A relative of BDSM involving the voluntary constriction of breathing during sex.
askgaybros,Cum Swapping,"Exchanging semen between partners after ejaculation - usually via kissing, oral sex, or rimming."
askgaybros,Docking,The insertion of a penis into the foreskin of another (uncircumcised) penis.
askgaybros,Edging,"Masturbating yourself or a partner almost reach orgasm but preventing them from doing so. Edging is typically a more standard encounter to extend the orgasm, whereas orgasm denial is often more sub/dom such as not 'allowing' the submissive partner to ejaculate."
askgaybros,Orgasm Denial,"Masturbating yourself or a partner almost reach orgasm but preventing them from doing so. Edging is typically a more standard encounter to extend the orgasm, whereas orgasm denial is often more sub/dom such as not 'allowing' the submissive partner to ejaculate."
askgaybros,Exhibitionism,"The act of being nude or performing sexual acts in public. Fetish ranges from harmless exposure in gardens, around the home, and with others to more risky acts where the individual could be caught in the act."
askgaybros,Fisting,The act of inserting a fist into a guy's anus. Often associated with sub/dom practices.
askgaybros,Frot,"Sexual practice between gay men involving contact between penises, mostly rubbing together."
askgaybros,Gloryholes,"A location with a wall, door, or surface with a hole specifically for the purpose of putting your penis through to be stimulated by another person. Often found in public bathrooms, changing rooms, locker rooms, public showers, and home-made gloryholes in more residential locations."
askgaybros,Humiliation,"Involves the domination of one partner over the other in a more psychological or verbal dimension. Includes small penis humiliation (where one partner humiliates the other for the size of their penis) and is related to feminization (the emasculation of a man), infantilization (treating an adult like a baby), and financial domination (the extreme spending of one partner's money by another)."
askgaybros,Rimming,"The performance of oral sex on an anus. Referred to colloquially as ""eating ass."""
askgaybros,Safe Word,A predetermined word that can be used to express that a sexual situation is making you uncomfortable or putting you in danger. Usually used with BDSM or related practices.
askgaybros,Scat,Similar to watersports but with feces instead.
askgaybros,Spit-play,"Sexual act of spitting on your partner during before, during, or after intercourse. Often associated with sub/dom/humiliation play."
askgaybros,Watersports,Sexual pleasure through one partner urinating on/in another. Often occurs with a dom/sub context.
asoiaf,ASOIAF,A Song Of Ice And Fire. The name of the whole series.
asoiaf,GRRM,George. R. R. Martin. Author of all the novels in the series.
asoiaf,AGOT,A Game Of Thrones. First novel in the series.
asoiaf,GOT,Game of Thrones. The name of the television series adapted from the books.
asoiaf,HBO,Home Box Office. The name of the television network that originally aired the series.
asoiaf,ACOK,A Clash Of Kings. The second novel in the series.
asoiaf,ASOS,A Storm Of Swords. The third novel in the series.
asoiaf,AFFC,A Feast For Crows. The fourth novel in the series.
asoiaf,ADWD,A Dance With Dragons. The fifth novel in the series.
asoiaf,TWOW,The Winds Of Winter. The sixth novel in the series (unpublished).
asoiaf,ADOS,A Dream Of Spring. The seventh and expected final novel in the series (unpublished).
asoiaf,D & E,Dunk & Egg. A series of novellas that take place ~80 years prior to the events of A Game of Thrones.
asoiaf,P & Q,The Princess and the Queen. A novella written from the perspective of a maester on the history of the Targaryen civil war.
asoiaf,RP,The Rogue Prince. A novella written from the perspective of a maester on the history just prior to the Targaryen civil war.
asoiaf,TWOIAF,"The World of Ice and Fire. A companion book to the series, written from a maester's perspective, presenting historical and cultural information about the world."
asoiaf,TPTWP,The Prince that was Promised. Legendary hero often discussed on /r/asoiaf.
asoiaf,AA,Azor Ahai. Another legendary hero often discussed on /r/asoiaf.
asoiaf,CotF,Children of the Forest. Mysterious race of beings that once inhabited Westeros according to the songs.
asoiaf,D&D,D.B. Weiss and David Benioff. Creators of the HBO show Game of Thrones.
asoiaf,Mod,"Your friendly moderators of /r/asoiaf, volunteers who help run the community"
asoiaf,Book!,"The character as they appear in the book series A Song of Ice and Fire, e.g., Book!Sansa"
asoiaf,B!,"The character as they appear in the book series A Song of Ice and Fire, e.g., B!Sansa"
asoiaf,Show!,"Show version. The character as they appear in the TV series Game of Thrones, e.g., Show!Ned"
asoiaf,S!,"Show version. The character as they appear in the TV series Game of Thrones, e.g., S!Ned."
asoiaf,AFAIK,As far as I know
asoiaf,AMA,"“Ask me anything”, a Q&A style discussion with the author of a post."
asoiaf,CCW,"“Comments and criticism welcome” or ""Constructive Criticism Welcome"""
asoiaf,CMV,Change my view
asoiaf,DAE,Does anybody else or does anyone else
asoiaf,DM;HS,Doesn’t matter; had sex
asoiaf,ELI5,Explain like I'm 5 (years old)
asoiaf,FIFY,Fixed It For You
asoiaf,FWP,First world problems
asoiaf,GGG,a reference to the “Good Guy Greg” or “Good Girl Gina” meme
asoiaf,GTFO,Get the f**k out
asoiaf,HIFW,How I feel when
asoiaf,HMB,Hold my beer
asoiaf,IAmA,"""I am a.” This is the standard way to begin the title of an AMA (Ask me anything) post."
asoiaf,IANAD,I am not a doctor
asoiaf,IANAL,I am not a lawyer
asoiaf,IIRC,If I recall correctly
asoiaf,IMO,In my opinion
asoiaf,IRL,In real life
asoiaf,IRL,In this thread
asoiaf,LOL,Laugh out loud
asoiaf,LoL,"“League of Legends”, a popular online game."
asoiaf,MRW,My reaction when
asoiaf,NSFL,"""Not safe for life"" (explicit and offensive; often gore)"
asoiaf,NSFW,"""Not safe for work"" (This label means that content may be considered offensive, and inappropriate for viewing in public spaces or when minors are present.This label covers, but is not limited to, any mature or explicit content, and can also include bawdy references or stories.)"
asoiaf,OAG,references the “Overly attached girlfriend” meme
