subreddit,term,description
churning,Manufactured Spending,"Manufactured spending (MS) is the process of purchasing cash equivalents with a rewards earning credit card, where the rewards earned are greater than the fees incurred. This includes gift cards, money orders, and the loading of prepaid debit cards."
churning,MS,Typically referring to the Morgan Stanley co-branded American Express Platinum credit card.
churning,Morgan Stanley,Typically referring to the Morgan Stanley co-branded American Express Platinum credit card.
churning,MSR,The minimum amount that must be spent on a credit card in order to qualify for a sign up bonus.
churning,Minimum Spending Requirement,The minimum amount that must be spent on a credit card in order to qualify for a sign up bonus.
churning,NLL,"Users are usually ineligible for the signup bonus on American Express cards that they've held in the past. However some offers occasionally contain no ""lifetime language"" allowing someone to get the bonus for a card they've had before."
churning,No Lifetime Language,"Users are usually ineligible for the signup bonus on American Express cards that they've held in the past. However some offers occasionally contain no ""lifetime language"" allowing someone to get the bonus for a card they've had before."
churning,NWTH,The reward given as the sign up bonus is not worth the credit inquiry and decreased average age of accounts that will temporarily hurt your credit score. A relatively sign up bonus of $100 may seem paltry compared to one worth $440.
churning,Not Worth The Hit,The reward given as the sign up bonus is not worth the credit inquiry and decreased average age of accounts that will temporarily hurt your credit score. A relatively sign up bonus of $100 may seem paltry compared to one worth $440.
churning,OD,Office Depot
churning,OM,Office Max
churning,OV,OneVanilla Prepaid Card
churning,OneVanilla,OneVanilla Prepaid Card
churning,P1,"Referring to spouses and other family members, usually in the same household, for whom the churner (Player 1) manages all credit cards and rewards. Points are usually pooled together when possible."
churning,P2,
churning,Player 1,"Referring to spouses and other family members, usually in the same household, for whom the churner (Player 1) manages all credit cards and rewards. Points are usually pooled together when possible."
churning,Player 2,
churning,PC,Banks will generally allow you to upgrade to annual fee cards or downgrade to lower/no fee cards although in most cases you will forego any sign up bonus offered. It's common for people to pick the Premium card e.g. Chase Sapphire Preferred and downgrade within a year to avoid the annual fee.
churning,Product Conversion,Banks will generally allow you to upgrade to annual fee cards or downgrade to lower/no fee cards although in most cases you will forego any sign up bonus offered. It's common for people to pick the Premium card e.g. Chase Sapphire Preferred and downgrade within a year to avoid the annual fee.
churning,Product Change,Banks will generally allow you to upgrade to annual fee cards or downgrade to lower/no fee cards although in most cases you will forego any sign up bonus offered. It's common for people to pick the Premium card e.g. Chase Sapphire Preferred and downgrade within a year to avoid the annual fee.
churning,PO,"RIP. Until November 2017, a commonly used source for purchasing Money Orders."
churning,Post office,"RIP. Until November 2017, a commonly used source for purchasing Money Orders."
churning,PP,Priority Pass Lounges
churning,Priority Pass,Priority Pass Lounges
churning,PPBDMC,PayPal Business Debit MasterCard
churning,PPMC,PayPal MyCash
churning,PRG,American Express Premier Rewards Gold Charge Card
churning,Premier Rewards Gold,American Express Premier Rewards Gold Charge Card
churning,Premium Card,Refers to any high annual fee card requiring a high credit score. Usually reserved for clients with a high income that will spend a lot on travel or dining. Examples are the Amex Platinum charge card and Chase Sapphire Reserve.
churning,Recon,The phone line for the CC company to request reconsideration of a pending or denied application.
churning,Reconsideration Dept.,The phone line for the CC company to request reconsideration of a pending or denied application.
churning,Reconsideration Line,The phone line for the CC company to request reconsideration of a pending or denied application.
churning,RLB,Referral Link Bot
churning,RT,Round Trip
churning,RT,An outbound and return flight from a single location.
churning,SC,Any reduction in the credit card account balance that shows up as a credit on the statement.
churning,Statement Credit,Any reduction in the credit card account balance that shows up as a credit on the statement.
churning,SM,A messaging system within an online banking portal used for communicating with a bank. Not all banks have a secure messaging system.
churning,Secure Message,A messaging system within an online banking portal used for communicating with a bank. Not all banks have a secure messaging system.
churning,Soft Pull,"A credit check that does not show up on your credit score. Usually performed by banks for checking accounts or by free credit score estimate services like Quizzle, Credit Karma, or Creditsesame."
churning,Inquiry,"A credit check that does not show up on your credit score. Usually performed by banks for checking accounts or by free credit score estimate services like Quizzle, Credit Karma, or Creditsesame."
churning,SPG,Starwood Preferred Guest Rewards Program
churning,Starwood Preferred Guest,Starwood Preferred Guest Rewards Program
churning,SUB,Sign Up Bonus
churning,SW,Southwest Airlines
churning,Southwest,Southwest Airlines
churning,T&C,The legal requirements you agree to when signing a credit card application.
churning,Terms & Conditions,The legal requirements you agree to when signing a credit card application.
churning,TPG,"""The Points Guy"" blog"
churning,The Points Guy,"""The Points Guy"" blog"
churning,TU,One of the three major credit bureaus.
churning,TransUnion,One of the three major credit bureaus.
churning,TYP,Citi Thank You Rewards Program
churning,ThankYou Points,Citi Thank You Rewards Program
churning,Triple Dip,"The action of receiving an annual travel credit from a premium card (such as Amex Platinum or Citi Prestige), 3 times with only a single annual fee charge by timing the cancellation of the card appropriately"
churning,UA,United Airlines
churning,UR,Chase Ultimate Reward Program
churning,Ultimate Rewards,Chase Ultimate Reward Program
churning,VGC,"Sold in many retail locations, a gift card that can be used, in the U.S. and District of Columbia, (almost) anywhere Visa is accepted. Fixed face value from $25 - $500, usually charges an activation fee between $3.95 - $6.95."
churning,Visa Gift Card,"Sold in many retail locations, a gift card that can be used, in the U.S. and District of Columbia, (almost) anywhere Visa is accepted. Fixed face value from $25 - $500, usually charges an activation fee between $3.95 - $6.95."
churning,WCW,"What Card Should I Get? thread, posted on Wednesdays."
churning,What Card Wednesday,"What Card Should I Get? thread, posted on Wednesdays."
churning,WF,Wells Fargo (or Whole Foods)
churning,WM,Walmart
churning,WN,"The proper IATA code for Southwest Airlines, but ""SW"" is more commonly used."
churning,Southwest,"The proper IATA code for Southwest Airlines, but ""SW"" is more commonly used."
churning,Y,"Letter designation for class of seat on an airline: F=first class, J=business class, Y=economy class"
churning,Economy Class,"Letter designation for class of seat on an airline: F=first class, J=business class, Y=economy class"
churning,YMMV,(Miles) May Vary A common saying meaning results may vary.
churning,Your Mileage (Miles) May Vary,(Miles) May Vary A common saying meaning results may vary.
churning,YQ,Fuel Surcharge when purchasing an airline ticket.
clashroyale,#/#/#/#,"syntax for displaying common/rare/epic/legendary levels (e.g. 9/7/4/1 is tournament standard). .5 values can be used to denote that some cards of that rarity are being upgraded to the next level while other cards are still at the previous level (e.g. 8.5 means some of that rarity are level 8, some are level 9)."
clashroyale,#-#,"in the context of challenges, displays wins to losses, respectively (e.g. 12-2 is winning 12 games and losing 2 games in a given challenge)."
clashroyale,#-# plant,"in the context of building placement, describes how many tiles away a building is placed from the river and from the tower currently being defended (e.g. 4-2 plant for the left tower is 4 tiles down from the river and 2 tiles to the right of the left tower). Common plants include 4-2 (generic placement), 4-3 (aggros tower-seekers but not other troops), and 4-1 (aggros flying tower-seekers)."
clashroyale,-info,"a command that calls a bot (/u/elexerbot) created by /u/kittens_from_space. The bot retrieves information of the given card (e.g. posting a comment ""-info lavahound"" on this subreddit will return information regarding the Lava Hound, including description, cost, and stats at every level). No longer active. More info."
clashroyale,/s,"sarcasm tag on Reddit (similar to tags in HTML), included after a post to explicitly denote sarcasm"
clashroyale,11th elixir ,"now patched, referred to the excess elixir known as elixir overcharge that built up after the elixir bar becomes full, allowing players to store up to 0.9 elixir."
clashroyale,12-0,the score of a challenge where someone wins all 12 games without losing once
clashroyale,2.6 Hog,"a Hog Rider cycle deck that averages 2.6 elixir, consisting of Hog Rider / Skeletons / Ice Spirit / Ice Golem / Musketeer OR Electro Wizard / Cannon OR Tombstone / Fireball OR Poison / The Log OR Zap"
clashroyale,2.9 Miner Poison,"a Miner and Poison cyclde deck that averages 2.9 elixir, consisting of Miner / Poison / Skeletons / Ice Spirit / Knight / Inferno Tower / The Log / Electro Wizard OR Musketeer"
clashroyale,2v2,Clan Battle
clashroyale,3-leg,triple legendary
clashroyale,3M,Three Musketeers
clashroyale,3 muskets,Three Musketeers
clashroyale,A#,Arena # (e.g. A1 = Arena 1)
clashroyale,aggro,to get a troop or building's focus as a target. Also used as a noun.
clashroyale,Air-Beatdown,"a deck that relies on exploiting anti-air weaknesses in other decks. Includes LavaLoon, among others."
clashroyale,anti-air,"a card that can be used to defend from air-based attacks (Balloon, Lava Hound, Minions, etc.). Includes Musketeer, Princess, Spear Goblins, Archers, Minions (including Minion Horde), and Tesla, among others."
clashroyale,anti-meta,"a card or deck designed to work to counter what is popular in the metagame. Guards, for instance, started gaining popularity to counter the omnipresent Mini P.E.K.K.A."
clashroyale,AoE,area of effect
clashroyale,area of effect,"a type of damage or effect that affects a given area, such as Arrows or Freeze"
clashroyale,Ash,a popular Clash Royale and Clash of Clans YouTuber. Not to be confused with Clash with Ash.
clashroyale,Baby D,Baby Dragon
clashroyale,bait deck,"a deck that utilizes several troops that are targeted by certain spells in order to overwhelm an opponent with threats that the spell normally counters (e.g. zap-bait decks often include Goblin Barrel, Fire Spirits, Sparky, Inferno Tower, Goblins, Spear Goblins, and/or Skeleton Army)"
clashroyale,barb,a Barbarian. plural: barbs.
clashroyale,barrel,Goblin Barrel
clashroyale,BD,Baby Dragon
clashroyale,Beatdown,"a deck archetype that focuses on fighting on the enemy side, maximizes troop synergy, adapts to defenses, and uses high damage-to-cost troops. Beatdown decks require specific counters or else the tower will risk falling. Generally includes tanks such as Giant, Golem, or Lava Hound. Beatdown is generally favorable against Siege but is generally unfavorable against Control."
clashroyale,Beatdown-Siege,"a deck that is a beatdown deck with a tank and support but exploits siege mechanics by sniping off the tower from afar, making killing the support troops difficult. It also has some burn elements. Includes Royal Giant decks."
clashroyale,best card in the game,the credit card
clashroyale,BH,Barbarian Hut
clashroyale,Blitz-Beatdown,"a deck that relies on swift cards to generate immediate threat to the tower using fast, high damage cards. Includes Hog Rider decks, among others."
clashroyale,BM,"bad manners or to bad manner. Examples include laughing or saying ""Thanks!"" at a misplay."
clashroyale,BR,Battle Ram
clashroyale,BRam,Battle Ram
clashroyale,Bren Chong,a multimillionaire who Clash With Ash always gives shoutouts to for whatever reason sponsors many tournaments and eSports teams in the game
clashroyale,bridge,the narrow strips of land connecting the friendly and enemy sides of the arena
clashroyale,bridge spam,"a strategy that triggers CMcHugh includes several cards meant to be placed at the bridge to immediately pressure a lane, such as Bandit and Battle Ram"
clashroyale,BT,"a strategy that triggers CMcHugh includes several cards meant to be placed at the bridge to immediately pressure a lane, such as Bandit and Battle Ram"
clashroyale,buff,an update to make something stronger or the act of making something stronger
clashroyale,burn card,"a card meant to chip away HP from an enemy crown tower that cannot be intercepted, same as direct damage"
clashroyale,CAN 50+ ROCKETS BREAK THE BRIDGE IN CLASH ROYALE?,"the title of an infamous clickbait video by Mastersaint, usually referenced to allude to ridiculous clickbait"
clashroyale,CB,Clan Battle
clashroyale,CC,Classic Challenge or Clan Chest (not to be confused with Clan Castle from Clash of Clans)
clashroyale,CCGS,same as Crown Championship Global Series
clashroyale,chain pull,using multiple cards to pull an attacking troop farther from its destination
clashroyale,chest cycle,the order in which chests are dropped from winning games on the ladder.
clashroyale,Chief Pat,"a popular Clash Royale and Clash of Clans YouTuber and Twitch streamer, formerly known as PlayClashOfClans."
clashroyale,Clash with Ash,"a popular Clash Royale and Clash of Clans YouTuber, also known as Ashlain. Not to be confused with the other Ash."
clashroyale,Clash with Cam,a popular Clash Royale and Clash of Clans YouTuber.
clashroyale,clickbait,"flashy titles and thumbnails that are generally considered irrelevant to the video, usually used in the context of YouTube"
clashroyale,clone skip,"a mechanic of the Clone Spell in which the normal troops are pushed left, the cloned troops are pushed right, and both ""skip"" for a short time. This can lead to various techniques, such as bypassing buildings, split pushing, or overriding deploy time."
clashroyale,Clyde's Tier List,a now discontinued series in which /u/ClydeCR would rank all of the cards in the game with their viability in the current tournament meta. Now continued by KairosTime Gaming.
clashroyale,CoC,"Clash of Clans, another popular Supercell game."
clashroyale,Control,a deck archetype that focuses on making positive elixir trades through defense on the user's side of the arena and uses specific cards to damage a tower with the excess elixir. Control deck users succeed by being mindful of the enemy's elixir count. Control is generally favorable against Beatdown but is generally unfavorable against Siege.
clashroyale,collector,Elixir Collector
clashroyale,counter,"a card, deck, or strategy that is designed to work well against an opposing card, deck, or strategy"
clashroyale,counter push,troops that survive on defense that now apply offensive pressure to the enemy
clashroyale,CR,Clash Royale
clashroyale,Crown Championship Global Series,a multiphase tournament officially hosted by Supercell in mid-2017.
clashroyale,CWA,Clash With Ash
clashroyale,cycle,the order in which a player's cards will appear. Can also refer to a player's trying to get a specific card previously deployed by deploying other cards (e.g. placing Skeletons to cycle for a Hog Rider)
clashroyale,cycle deck,"a control deck that depends on cheap cards to continuously pressure the opponent and chip away at their tower through the use of cycling to quickly redeploy a specific card. Common cycle decks feature Miner, Hog Rider, and/or Mini P.E.K.K.A."
clashroyale,Daily Card Discussion,"a control deck that depends on cheap cards to continuously pressure the opponent and chip away at their tower through the use of cycling to quickly redeploy a specific card. Common cycle decks feature Miner, Hog Rider, and/or Mini P.E.K.K.A."
clashroyale,Dank Prince,Dark Prince
clashroyale,DC,disconnect
clashroyale,death nova,"in context of the Ice Golem, the death effect consisting of damage and slowdown in an explosive range"
clashroyale,DG,Dart Goblin
clashroyale,doot,an onomatopoeia associated with Skeletons or skeleton-based troops.
clashroyale,double spirit,a deck that uses the Ice Spirit and Fire Spirits
clashroyale,DP,Dark Prince
clashroyale,DPS,damage per second
clashroyale,direct damage,"a spell that can be cast anywhere on the map to directly damage a troop or building; the damage cannot be interrupted or prevented. Includes Arrows, Fireball, Lightning, Rocket, Zap, Poison, and (generally) the Log."
clashroyale,double prince,"a deck that uses the Prince and the Dark Prince, where the Dark Prince complements the Prince's strong single-target damage with his splash damage"
clashroyale,Draft Challenge,"a game mode in which four pairs of cards are presented to you, and you choose one card from each pair while giving the other card to your opponent."
clashroyale,Draft Royale,"a custom tournament held by the Rum Ham in which players take turns choosing one card from all of the available cards in the game, and no player can choose (draft) a card that any other player has chosen (drafted)."
clashroyale,drag,"Dragon, as in Baby Dragon (Baby Drag) or Inferno Dragon (Inferno Drag)"
clashroyale,EB,Elite Barbarians
clashroyale,E-barbs,Elite Barbarians
clashroyale,EC ,Elixir Collector
clashroyale,Elite Barbs,Elite Barbarians
clashroyale,elixir-negative,same as negative elixir trade
clashroyale,elixir overcharge,"now patched, referred to the fluidity of elixir (not being integer values) that built up after 10 elixir was stockpiled, allowing players to have up to 0.9 extra elixir."
clashroyale,elixir-positive ,"now patched, referred to the fluidity of elixir (not being integer values) that built up after 10 elixir was stockpiled, allowing players to have up to 0.9 extra elixir."
clashroyale,elixir pump,Elixir Collector
clashroyale,emote,a predetermined message that can be sent to another player in-battle
clashroyale,even elixir trade,an interaction of cards where one player's card(s) nullifies another's for the same amount of elixir
clashroyale,E-Wiz,Electro Wizard
clashroyale,EW,Electro Wizard
clashroyale,ExeNado,"Exectuioner and Tornado, generally used in the same deck as the two cards have good synergy"
clashroyale,f2p,"free-to-play, a player that does not and has not spent money on the game"
clashroyale,Fair Play,an announcement by Supercell that it seeks to uphold principles of fair play and safe play and discourages bullying
clashroyale,FB,Fireball
clashroyale,feeder,"in the context of clans, a clan that is associated with another clan whose existence is generally due to limitations in clan membership"
clashroyale,Galadon,a popular Clash Royale and Clash of Clans YouTuber.
clashroyale,GB,Goblin Barrel
clashroyale,GC,Grand Challenge
clashroyale,gemmer,"a player that buys gems, a pay-to-play"
clashroyale,gg,good game
clashroyale,GG,Goblin Gang
clashroyale,GiLoon, a beatdown deck that uses Giant and Balloon to quickly take down towers. Generally includes arrows for Minions.
clashroyale,git gud,get good
clashroyale,gl,good luck
clashroyale,glass cannon ,"a high-damage troop with relatively low health. Includes Musketeer, Wizard, Princess, and Mini P.E.K.K.A (disputed), among others."
clashroyale,Gob,short for Goblin
clashroyale,Goison,"a beatdown deck that uses Giant and Poison to build elixir advantages, overwhelm the opponent, and kill counterpushes. Almost always uses Elixir Collector and Zap. This deck has largely evolved over time. The original is the Shanghai deck (see below). Lumberjack had some (limited) experimentation over Mini PEKKA. Ice Spirit would end up taking the preferred spot over the Princess. For a while, Bowler would fill a role over either Ice Spirit, Mini PEKKA, or Musketeer, and Prince would gain momentum in Mini PEKKA's spot to use against Bowler. When the Mega Minion was released, a standard Goison deck emerges: Giant / Poison / Mega Minion / Elixir Collector / Zap / Prince / Ice Spirit / Guards (or sometimes Musketeer). The Mega Minion is often played behind the Giant while the Giant crosses the bridge. This deck, however, sees very little play now because of the October Poison nerf and Elixir Collector rework."
clashroyale,Gravy Bowl,"A deck that utilizes Graveyard and Bowler, where the Bowler defends, counterpushes, and tanks for the Graveyard's Skeletons."
clashroyale,GS,Giant Skeleton
clashroyale,GY,Graveyard
clashroyale,hf,have fun
clashroyale,Hog,Hog Rider
clashroyale,horde,Minion Horde
clashroyale,Hound,Lava Hound
clashroyale,Hog,Hog Rider
clashroyale,Hog trifecta,"a deck that uses Valkyrie, Musketeer, and Hog Rider. The most standard hog trifecta deck is Valkyrie, Musketeer, Hog Rider, Zap, Poison, Elixir Collector, Cannon, and Skeletons."
clashroyale,HP,hit points
clashroyale,hut,a Goblin Hut or Barbarian Hut. Players that use decks with both are sometimes referred to as hut spammers.
clashroyale,Ice wiz,Ice Wizard
clashroyale,ID,Inferno Dragon
clashroyale,IG,Ice Golem
clashroyale,IT,Inferno Tower
clashroyale,IW,Ice Wizard
clashroyale,Jason deck,a deck used by tournament-winning Jason in the Helsinki tournament. Consists of Giant / Hog Rider / Archers / Spear Goblins / Barbarians / Minion Horde / Arrows / Elixir Collector.
clashroyale,kiting,diverting an attacking troop to the opposite lane by dropping distraction troops that it follows
clashroyale,lane,one of the two halfs of the arena leading to one of the crown towers
clashroyale,LavaLoon,"a beatdown deck that uses Lava Hound and Balloon to take advantage of an opponent's weak anti-air cards. The Lava Hound distracts while the Balloon does a lot of damage, and the Balloon can tank for the Lava Pups when the Lava Hound dies."
clashroyale,league,a 300-trophy division from 4000 trophies and higher
clashroyale,leg,legendary
clashroyale,leggie,legendary
clashroyale,level wall,a theoretical point where one cannot continue to gain trophies given the player's card and crown tower levels
clashroyale,LH,Lava Hound
clashroyale,LJ,Lumberjack
clashroyale,log,The Log
clashroyale,loon,Balloon
clashroyale,lvl 8 a8 f2p,"level 8 arena 8 free-to-play, a term, often used ironically, to describe players who boast about their skill as a free-to-play. Somewhat outdated term with Legendary Arena now being Arena 9 11."
clashroyale,MOLT,a popular Clash Royale and Clash of Clans YouTuber.
clashroyale,mana,"an incorrect term for elixir, often used in RPGs"
clashroyale,melee goblins,the goblin unit (or the 2-elixir Goblins card) that has melee range
clashroyale,meta,Most Effective Tactic Available (same as metagame in this usage)
clashroyale,metagame,"decks, cards, and strategies that are popular in the game at the moment, gameplay and strategy beyond the surface level of the game"
clashroyale,Meta Minion,"Mega Minion, with implications of the card being extremely common in the meta, namely during the Goison era"
clashroyale,MH,Minion Horde
clashroyale,mini-tank,"a troop that has a solid amount of health used for distraction but does not have extremely high HP as a tank would. Includes Valkyrie, Knight, Sparky, and Bowler, among others."
clashroyale,missed rocket,a joke alluding to when Chief Pat famously missed a Rocket while targeting a Balloon.
clashroyale,MM,Mega Minion
clashroyale,multi-drop,"a technique where two or more cards are dragged and dropped simultaneously, allowed by Clash Royale's multitouch capability. Quick drop is generally preferred, however."
clashroyale,musk,Musketeer
clashroyale,nado,Tornado
clashroyale,naked,describes a card that is used without other supporting cards (e.g. a naked Hog Rider is a Hog Rider deployed without support cards)
clashroyale,negative elixir trade,an interaction of cards where one player must expend more elixir to nullify another's cards than the opponent spent for the cards
clashroyale,nerf,an update to make something weaker or the act of making something weaker
clashroyale,Nick,a popular Clash Royale and Clash of Clans YouTuber.
clashroyale,nickatnyte,a popular Clash Royale and Clash of Clans YouTuber.
clashroyale,Nova eSports,a clan family consisting of players sponsored by Nova eSports
clashroyale,NW,Night Witch
clashroyale,Oh Long Johnson,"aside from being a cat meme, a popular YouTube channel for Clash Royale, known for editing and compiling submitted clips of the game to make them humorous."
clashroyale,OJ,"a popular YouTube channel for Clash Royale, known for its informative guides and strategy videos."
clashroyale,OLJ,"aside from being a cat meme, a popular YouTube channel for Clash Royale, known for editing and compiling submitted clips of the game to make them humorous."
clashroyale,OP,overpowered. May also refer to original poster or original post online.
clashroyale,Orange Juice Gaming,"a popular YouTube channel for Clash Royale, known for its informative guides and strategy videos."
