subreddit,term,description
mechanicalkeyboards,Original Design Manufacturer,The manufacturer is heavily involved in designing the product - often patenting new inventions. For example a Logitech / Omron Romer-G switch design would generally involve engineers from both companies working together. Often keyboard designs are sold to mutliple companies under different brands.
mechanicalkeyboards,OEM,"Original Equipment Manufacturer, a more generic term for the keyboard or key manufacturing company that manufactures the product. Ranges from a contract manufacturer to a ODM."
mechanicalkeyboards,OCN,"Overclock.net, a forum focused on overclocking and computer hardware. Has a relatively popular keyboard-section."
mechanicalkeyboards,Otaku,A marketing term coined by Elitekeyboards to refer to the blank keys version of the Filco. Das keyboard (Metadot) was first to market with commonly available versions of blank keyboards and used it effectively for lots of free PR. Before you buy ONLY on looks read this Otaku ProTip!
mechanicalkeyboards,PBT,"Polybutylene Terephtalate plastic. PBT is a harder long wearing material with a ""sandier feel"". The downside is the brittle nature of PBT and expense so most keyboard manufacturers do not use for either keyboard cases or keys. For more info see the Key Reference Wiki"
mechanicalkeyboards,PING!,"Since most mechanical switches have a spring inside you can get a high frequency ""pingy"" noise, distinct from the click or clack sounds. See the McRip Wiki for information and fixes."
mechanicalkeyboards,Plate Mounted,Switches can be mounted onto a metal plate over a PCB (circuit board) or directly to the PCB. This tends to affect switch feel and build quality of the board.
mechanicalkeyboards,PCB Mounted,Switches can be mounted onto a metal plate over a PCB (circuit board) or directly to the PCB. This tends to affect switch feel and build quality of the board.
mechanicalkeyboards,PMK,"impMyKeyboard, a website by Signature Plastics where individuals can upload ideas for keycap sets. If there is enough interest, the set is presented in a ""group buy"" and manufactured by Signature Plastics if there are enough participants."
mechanicalkeyboards,POM,"Polyoxymethylene plastic or better known by the brand name ""Delrin"". An abrasion-resistant, solvent-resistant and low-friction material. However it is expensive and not common. For more info see the Key Reference Wiki"
mechanicalkeyboards,POS,"Point Of Sale keyboard, for cash registers and such."
mechanicalkeyboards,PS/2,Introduced with the PS/2 IBM systems in 1987 this became the defacto method of connecting mice and keyboards for many years. Now slowly being phased out in favor of USB. See the comparison with USB wiki.
mechanicalkeyboards,QFR,"QuickFire Rapid, a line of mechanical keyboards by Coolermaster."
mechanicalkeyboards,Riding the Activation Point,"This is different than ""Double Tap"". It's a useful for technique for ""spamming"" one key stroke by keeping the switch in the middle of it's travel distance so you can send multiple keypresses without fully releasing OR fully depressing the key. You can't really do that with a rubber dome."
mechanicalkeyboards,RipOmeter,Using USA Nickels to measure switch stiffness. Details here.
mechanicalkeyboards,RTFW,Read The Fine Wiki.
mechanicalkeyboards,Scan Rate,The keyboard matrix is scanned at rate set by the firmware engineer. It is a tradeoff between the key bounce characteristics of the switch and the desire to scan as quickly as possible for optimum typing/gaming.
mechanicalkeyboards,Sprue Mark,"In making a plastic molded piece hot plastic is injected through nozzles called ""sprues"". After ejection from the mold they leave a tiny mark."
mechanicalkeyboards,Slider,"""Slider"" is often seen in reference to Alps switches. Sliders are the component of the keyswitch that moves up and down and is directly responsible for actuation."
mechanicalkeyboards,Stem,The center part of the keycap that allows attachment to a switch stem.
mechanicalkeyboards,SP,"Signature Plastics, keycap manufaturer."
mechanicalkeyboards,SPST,Single Pole Single Throw Switch. Almost ALL keyboard switches are NO SPST momentary switches.
mechanicalkeyboards,SSK,Space Saving Keyboard. IBM's 81 key tenkeyless version of the 101 key IBM Model M.
mechanicalkeyboards,STRG,"Seen on German keyboards. STRG is short for Steuerung (Steuerung literally means steering, in this case it means control)"
mechanicalkeyboards,Tactile force,"Similar to the Activation point/Activation force point but at the top of the tactile ""bump""."
mechanicalkeyboards,Tactile point,"Similar to the Activation point/Activation force point but at the top of the tactile ""bump""."
mechanicalkeyboards,"Tactile ""bump""",The resistance of the switch increases until you feel the force rise suddenly and then the resistance decreases. This can be pretty subtle on some switches.
mechanicalkeyboards,Tampoprint,Not what you're thinking. It's the name of a German Company that manufactures the machine that does pad printing.
mechanicalkeyboards,Tea Axis,Sometimes used by Asian keyboard manufacturers to refer to Brown Cherry MX switches. From the Japanese word Kobicha - cha is tea.
mechanicalkeyboards,Tenkeyless,Term for keyboards that don't have a numeric keypad section and are therefore narrower and some say more ergonomic. Some have embedded number pads in the right portion of the main key cluster like some laptops.
mechanicalkeyboards,Topre,"Manufacturer of capacitive keyboards. Although not Mechanical in the traditional spring and metal contact switch sense they still are considered ""Mechanical"" here because the switch activates in the middle of the stroke unlike a rubber dome. Pronouced Toh pu REH"
mechanicalkeyboards,Topre Fart,The sticky sound you sometimes get from a topre rubber dome. NOT the Clack sound you get from the key return and that is minimized in the HHKB Silent designs by foam pads. Ripster Guide
mechanicalkeyboards,TK,"Team Kill. hah, I keed. Coolermaster Quickfire uses it for a TKL but with tenkey."
mechanicalkeyboards,TKL,"Guitar and Mandolin case company. hah, I keed. It means Tenkeyless (without numpad)."
mechanicalkeyboards,Travel,"""Key Travel"", ""Switch Travel"". The distance the key travel from the top of the stroke to the bottom. More in the Key Travel Wiki here. Basically how much the keys move when you press them down."
motorcycles,ATGATT,"An abbreviation for All The Gear All The Time - this is the prevailing attitude when it comes to being sensible and responsible on a motorcycle. If you wear all the gear all the time, you will always be mitigating the risk of injury as much as possible. ATGATT or not, this is pretty much your call."
motorcycles,Squid,"The typical image of a squid is a rider on board a sport(s)bike wearing usually a t-shirt and jeans or shorts with trainers. Often a squid will ride without a helmet. The origins of the word are sometimes worth arguing about but Stupidly QUick, Imminently Dead sums up the typical attitude of onlookers and most motorcyclists."
motorcycles,Cager,Car driver. Can be derogatory even though many motorcyclists do drive cars.
motorcycles,Ape Hangers,Much higher than average handlebars on motorcycles.
motorcycles,Pillion,"Seat behind the main cushion, sometimes referred to as the person riding behind the motorcyclist."
motorcycles,Poker Run,A road rally style motorcycle run where riders stop at 5 checkpoints along the route to draw playing cards. At the end of the run the rider with the best poker hand wins.
motorcycles,Rake,The angle of the motorcycle's front fork. The extended rake on choppers make them stable but lacking agility.
motorcycles,Baffle,Sound deadening material inside the muffler. Materials used for this vary. Aftermarket motorcycle exhausts often allow the rider to add or remove baffles to adjust the back pressure to tune performance.
motorcycles,Counter-steering,"At speed, a motorcycle is controlled by turning the handlebars away from direction you want to turn. Summary - push the right handgrip forward to turn right, push the left handgrip forward to turn left. Motorcycle steering is accomplished by leaning and turning your front wheel to the left which will make the bike lean (and turn) right and vice versa. YouTube video on counter-steering: https://www.youtube.com/watch?v=EFm3honeTQo"
motorcycles,Track Days," A track day is an organized event in which non-members are allowed to drive or ride around established motor racing circuits, or alternatively (though far less common) on closed or disused airfields. Most race tracks around the world now provide this facility, where a road legal or track prepared car or motorcycle can be used without speed restriction (as if racing, though the practice of actual racing is almost exclusively forbidden at these events) by members of the public. Criteria for being eligible to participate is usually the holding of a driving license for the vehicle in question or the appropriate racing license for the event can also be used and the payment of a fee."
motorcycles,Fairings,The plastic body panels that protect the rider from the wind and rain and (to some extent) from other debris.
motorcycles,LEO,"Law Enforcement Officer, aka ""Road Pirate"", aka ""Po-Po"", aka ""5-Oh"", aka ""Oh $HIT""."
motorcycles,Performance Award,"A reward for going over the speed limit, usually given by a ""LEO""."
motorcycles,Get-Off,When a motorcyclist unintentionally leaves the motorcycle at speed.
motorcycles,Sliders,"Devices installed on either side of the motorcycle in an attempt to keep the motorcycle from being injured in the event of a ""Get-Off"". Sometimes controversial as one camp says they actually increase the odds your motorcycle will accrue more damage in the event of a ""Get-Off"" while the other says they protect enough to justify their existence."
motorcycles,Lid,Slang for helmet.
motorcycles,Crotch Rocket,"AKA Sport Bike - A motorcycle with high footpegs that position the legs closer to the body to improve ground clearance when cornering, and a long reach to the hand controls, which positions the body and center of gravity forward, above the fuel tank. The rider leans forward into the wind, the force of which can comfortably support the rider's weight at speeds near 100 mph (160 km/h), but at lower speeds leaves too much weight on the arms and wrists, causing fatigue, unless legs are used to support the back, arms and wrist. They're usually classified as having higher horsepower output and, as such, are good candidates for ""track days""."
motorcycles,Standard,"Motorcycle recognized primarily by their upright riding position, partway between the reclining rider posture of the cruisers and the forward leaning sport bikes. Footpegs are below the rider and handlebars are high enough to not force the rider to reach far forward, placing the shoulders above the hips in a natural position. Because of their flexibility, lower costs and their engines of moderate output, standards are particularly suited to motorcycle beginners."
motorcycles,Cruiser,"Cruisers are styled after American machines from the 1930s to the early 1960s, such as those made by Harley-Davidson, Indian, and Excelsior-Henderson. Harley-Davidsons largely define the cruiser category, and large-displacement V-twin engines are the norm, although other engine configurations and small to medium displacements also exist. Their engines are tuned for low-end torque, making them less demanding to ride because it is not necessary to shift as frequently to accelerate or maintain control. Cruisers are sometimes called ""custom"" even in the absence of aftermarket modifications."
motorcycles,Sport-Tourer,"Combines attributes of sport bikes and touring motorcycles. The rider posture is less extreme than a sport bike, giving greater long-distance comfort. Accommodation for a passenger is superior to a sport bike as well, along with increased luggage capacity."
motorcycles,Dual-sport," Dual-sports, sometimes called dual-purpose or on/off-road motorcycles, are street legal machines that are also designed to enter off-road situations. Typically based on a dirt bike chassis, they have added lights, mirrors, signals, and instruments that allow them to be licensed for public roads. They are higher than other street bikes, with a high center of gravity and tall seat height, allowing good suspension travel for rough ground."
pathofexile,Adds,Enemies that spawn during a boss encounter
pathofexile,AoE,Area Of Effect
pathofexile,BM,Blood Magic
pathofexile,B/O,Buy Out
pathofexile,CI,Chaos Inoculation
pathofexile,C/O,Current Offer
pathofexile,DoT,Damage Over Time
pathofexile,DPS,Damage Per Second
pathofexile,EA,Explosive Arrow
pathofexile,EB,Eldritch Battery
pathofexile,EK,Ethereal Knives
pathofexile,ES,Energy Shield
pathofexile,Eva,Evasion
pathofexile,GCP,Gemcutter's Prism
pathofexile,GS,Ground Slam
pathofexile,GM,Game Moderator - GMs can affect the game to resolve issues; synonymous with administrator
pathofexile,GMP,Greater Multiple Projectiles
pathofexile,IIQ,Increased Item Quantity
pathofexile,IIR,Increased Item Rarity
pathofexile,IR,Iron Reflexes
pathofexile,LA,Lightning Arrow
pathofexile,LMP,Lesser Multiple Projectiles
pathofexile,LS,Lightning Strike
pathofexile,Mob,"""Mobile"", from old MUD games, but it means ""Monster"""
pathofexile,Ninja,A player who takes drops that aren't theirs (hard to determine in this game because of the loot timers)
pathofexile,OBO,Or Best Offer
pathofexile,Reroll,To make a new character or randomize the attributes/stats on an item (depending on context)
pathofexile,RoE,Radius of Effect
pathofexile,RT,Resolute Technique
pathofexile,Toon,A character
pathofexile,TP,Town portal
pathofexile,WP,WayPoint
pathofexile,WTB,Want To Buy
pathofexile,WTS,Want To Sell
pathofexile,WTT,Want To Sell
pokemontrades,5IV,"A number of the Pokémon's IV stats are ""optimal"". In most cases, this simply means they have a value of 31 (e.g. for 5IV, 31/x/31/31/31/31). However, in some cases the Speed or Attack stat may be 0 instead (e.g. 31/x/31/31/31/0 or 31/0/31/31/31/31)."
pokemontrades,AB,"Pokémon caught in Apricorn balls: Level Ball, Moon Ball, Lure Ball, Friend Ball, Love Ball, Fast Ball, and Heavy Ball."
pokemontrades,Apricorn Ball,"Pokémon caught in Apricorn balls: Level Ball, Moon Ball, Lure Ball, Friend Ball, Love Ball, Fast Ball, and Heavy Ball."
pokemontrades,BB,"Pokémon caught or bred in a type of Ball that, until Sun and Moon, could only originate from a previous-generation game. Includes the Dream Ball, Apricorn Balls, the Safari Ball and the Sport Ball."
pokemontrades,Bank Ball,"Pokémon caught or bred in a type of Ball that, until Sun and Moon, could only originate from a previous-generation game. Includes the Dream Ball, Apricorn Balls, the Safari Ball and the Sport Ball."
pokemontrades,BB,Type of Poké Ball introduced in Sun & Moon.
pokemontrades,Beast Ball,Type of Poké Ball introduced in Sun & Moon.
pokemontrades,BP,"Battle Points gained at the Battle Maison, Battle Tree or Battle Royal and exchanged for items."
pokemontrades,BR,"Battle Ready, Pokémon that have the ideal level, moveset, and EVs for battle."
pokemontrades,Breedable,"Pokémon whose valuable attributes can be passed down by breeding: IVs, nature, egg moves, abilities and Ball."
pokemontrades,Breedject,"Pokémon left over from breeding sessions (""breeding rejects""). Imperfect qualities (incorrect nature or ability, sub-par IVs) are implied."
pokemontrades,CFW,Custom Firmware. Modified 3DS software that can run unofficial programs.
pokemontrades,Chain,Shiny Pokémon caught using the PokeRadar.
pokemontrades,Chained,Shiny Pokémon caught using the PokeRadar.
pokemontrades,Chaining Services,Shiny Pokémon caught using the PokeRadar.
pokemontrades,Checkpoint,A homebrew program to backup/restore saves.
pokemontrades,Citra,A Nintendo 3DS emulator.
pokemontrades,Competitive,"Pokémon with advantageous statistics: IVs, nature, attacks/egg moves, ability."
pokemontrades,Custom shiny,"A shiny Pokémon bred exactly to someone's specifications, usually through SV hatching."
pokemontrades,DB,Dream Ball. See BB or Bank Ball.
pokemontrades,DBHA,Pokémon in a Dream Ball (DB) with its Hidden Ability (HA).
pokemontrades,Dex,Abbreviation for Pokédex.
pokemontrades,DW,Dream World. Nintendo-hosted website that rewarded players with Hidden Ability Pokémon.
pokemontrades,DWF,"Dream World Female, only a female could pass on a HA on generation 5."
pokemontrades,EM,"Egg Move, a move that can be passed down by the parents."
pokemontrades,EmuNAND,"A separate partition on your SD card that essentially acts as a separate console, made possible by CFW. You can have EmuNANDs of different regions on the same 3DS, all capable of providing legal region data as long as they are configured correctly. See this mod post for more info."
pokemontrades,ESV,Egg Shiny Value. See Shiny value.
pokemontrades,EV,Effort Value. Hidden value influencing a Pokémon's statistics.
pokemontrades,Event,Pokémon distributed during a promotional event. Additional information on event Pokémon can be found in our wiki.
pokemontrades,Event check,"Process to extract from a game Pokémon that usually cannot be uploaded to Pokécheck. Exclusive to generations 4 and 5, now largely irrelevant."
pokemontrades,Event checker,"Person able to do event checks. Exclusive to generations 4 and 5, now largely irrelevant."
pokemontrades,FC,"Friend Code. Unique identifier for a console, required to complete trades."
pokemontrades,FC,Festival Coins. Type of currency for the Festival Plaza in Sun & Moon.
pokemontrades,File Trade,A trade involving Pokémon files extracted from the games. See the file trading guide for more info.
pokemontrades,FT,For Trade.
pokemontrades,HA,"Hidden Ability, a third ability that was once only available through the Dream World."
pokemontrades,Hatch thread,Most competitive shinies in generation 6 originate from Shiny Value abuse (also known as shiny hatching) done on /r/SVExchange. The hatch thread is where the Pokémon was first obtained.
pokemontrades,HB,Hoenn Born. See KB.
pokemontrades,Homebrew,Unofficial programs running on a console.
pokemontrades,HP,"Hidden Power, an attack with a typing dependent on the IVs."
pokemontrades,Imperfect,Pokémon with non-optimal IVs or hindering nature.
pokemontrades,ID No.,"Identification number, 5-digit (up to OR/AS) or 6-digit (starting from SuMo) identifier given to a trainer that will appear on every Pokémon caught or hatched by them. Can be found on the Pokémon's summary screen."
pokemontrades,IGN,"In-Game Name, the name you gave your character when you started playing the game."
pokemontrades,IOU,"""I owe you""; deferred payment for a trade occurring now. Not allowed on the subreddit."
pokemontrades,IV,"Individual Value, the ""DNA"" of the Pokémon, stated as HP/Attack/Defence/Special Attack/Special Defence/Speed."
pokemontrades,JKSM,"JK's Save Manager, a homebrew program to backup/restore saves."
pokemontrades,KB,"Kalos Born, or Kalos Bred. Pokémon originating from Kalos (the region of X/Y) and showing a blue pentagon on its summary screen."
pokemontrades,Legendary,Pokémon that can only be obtained once per playthrough and cannot be bred.
pokemontrades,LF,Looking For.
pokemontrades,MM,"Masuda Method, international breeding for higher chances of shininess. Based on the Pokémon's language."
pokemontrades,NN,Nickname[able]. Pokémon whose nickname can be changed by its original trainer.
pokemontrades,NNable,Nickname[able]. Pokémon whose nickname can be changed by its original trainer.
pokemontrades,Nature,The nature of a Pokémon usually grants a bonus to a statistic and a penalty to an other. See Bulbapedia for a full listing.
pokemontrades,NTR,An application available for devices with CFW that allows you to run plugins during games. These plugins can read and in some cases write data on games.
pokemontrades,NTSC,"The ""opposite"" of PAL, and can refer to consoles from North America and Asia. Named after the analog television color system used in those regions."
pokemontrades,OT,"Original Trainer, name of the trainer who caught or hatched the Pokémon. Can be found on any Pokémon's summary screen."
pokemontrades,Perfect,"Varies by user, but typically refers to a Pokémon with at least five advantageous IV statistics and an adequate nature."
pokemontrades,PAL,"A 3DS ""region"" that covers Europe, Australia, New Zealand, South Africa, and select other countries. Opposite term to NTSC, and named after the PAL color encoding system generally used in those regions."
pokemontrades,PC,"Pokémon Center, physical shops located in Japan."
pokemontrades,PCalc,An NTR plugin that reads data from the game's memory. Note that it also allows for pausing the game and manually advancing frames.
pokemontrades,PGL,"Pokémon Global Link, an official Pokémon website which occasionally distributes events."
pokemontrades,PID,Pokémon IDentifier. The PID is a unique number tied to each Pokémon and is not visible during normal gameplay.
pokemontrades,PKSM,A homebrew program to backup/restore saves.
pokemontrades,PM,Private Message.
pokemontrades,Pokécheck,Website that analyzed the legality of Pokémon during the generation 5 era. Now closed.
pokemontrades,Pokérus,"""Virus"" that spreads between the Pokémon in your party and grants them a bonus in EV gains. Avoid spreading it if you want the Pokémon in your party to remain ""untouched""."
pokemontrades,Porybox,A website for uploading and displaying full details of your Pokémon collection. Currently features clone checking as well.
pokemontrades,PS,"Cheating device manufactured by Datel that allows a player to edit their saved game, notably by injecting hacked Wonder Cards."
pokemontrades,PowerSaves,"Cheating device manufactured by Datel that allows a player to edit their saved game, notably by injecting hacked Wonder Cards."
pokemontrades,QR Code,"Image that, once scanned in Sun & Moon, grants access to special islands & events."
pokemontrades,QR Code Injection,Short-lived exploit that allowed to edit your XY/ORAS save through a bug of the 3DS' web browser. Now patched by Nintendo.
pokemontrades,Redeem,"Act of obtaining a Pokémon event from somebody's else code, and trading them said event."
pokemontrades,Reference,Feedback system set up at hq.porygon.co.
pokemontrades,RNG,"Random Number Generator, high level of in-game control to influence the Pokémon you encounter. RNG abuse is not cheating/hacking."
pokemontrades,RNG Abuse,"Random Number Generator, high level of in-game control to influence the Pokémon you encounter. RNG abuse is not cheating/hacking."
pokemontrades,Reservation thread,"A thread in which someone is offering or looking for events that have been announced, but have not yet begun."
pokemontrades,Scrap,"Refers to a 12-digit code distributed with certain Japanese merchandise as part of the Pokéscrap promotion, which yields serial codes to redeem event Pokémon."
pokemontrades,Scrap code,"Refers to a 12-digit code distributed with certain Japanese merchandise as part of the Pokéscrap promotion, which yields serial codes to redeem event Pokémon."
pokemontrades,Shiny value,"Starting from X/Y, each egg is given a random value (ESV, Egg Shiny Value) when generated. Each saved game also has a random value (TSV, Trainer Shiny Value). If the two match, the Pokémon will hatch shiny. See /r/SVExchange."
pokemontrades,Shiny hatching,"Starting from X/Y, each egg is given a random value (ESV, Egg Shiny Value) when generated. Each saved game also has a random value (TSV, Trainer Shiny Value). If the two match, the Pokémon will hatch shiny. See /r/SVExchange."
pokemontrades,SID,"5-digit identifier given to a trainer that will appear on every Pokémon caught or hatched by them, but that cannot be viewed in-game in normal circumstances."
pokemontrades,Secret ID,"5-digit identifier given to a trainer that will appear on every Pokémon caught or hatched by them, but that cannot be viewed in-game in normal circumstances."
pokemontrades,SO,Self-Obtained (Event).
pokemontrades,SOE,Self-Obtained (Event).
pokemontrades,Spread,Distribution of the IVs displayed as 6 consecutive numbers (eg 31/31/31/x/31/31).
pokemontrades,IV Spread,Distribution of the IVs displayed as 6 consecutive numbers (eg 31/31/31/x/31/31).
pokemontrades,SR,Resetting your game repeatedly to capture a Pokémon with an advantageous nature or IVs.
pokemontrades,Soft Reset,Resetting your game repeatedly to capture a Pokémon with an advantageous nature or IVs.
pokemontrades,Static PID,"See PID. Some events in 4th and 5th generations had static PIDs which makes them harder to distinguish from each other. For more information, refer to our wiki article on static PIDs."
pokemontrades,Stock,"May generally refer to an event redemption done where few or no disclosure cases apply, but the exact usage is up for debate and should not be assumed. See here for more information."
pokemontrades,Stock redeem,"May generally refer to an event redemption done where few or no disclosure cases apply, but the exact usage is up for debate and should not be assumed. See here for more information."
pokemontrades,SVDT,A homebrew program to backup/restore saves. See here for more information.
pokemontrades,Sync,Shorthand for a Pokémon with the Synchronize ability.
pokemontrades,TID,See ID No.
pokemontrades,Touch trade,See tradeback.
pokemontrades,TR,IV spread which features a Speed stat of 0 (eg 31/31/31/x/31/0).
pokemontrades,Trick Room,IV spread which features a Speed stat of 0 (eg 31/31/31/x/31/0).
pokemontrades,Trophy shiny,"Pokémon that is shiny without being competitive: it is lacking an advantageous nature, good IVs or egg moves."
